{
  "$schema": "https://json-schema.org/draft/2020-12/schema",
  "title": "assets database schema",
  "type": "object",
  "required": [
    "database",
    "schema_version",
    "minimum_engine_version",
    "last_updated",
    "record_count",
    "records"
  ],
  "properties": {
    "database": {
      "type": "string",
      "const": "assets"
    },
    "schema_version": {
      "type": "integer",
      "const": 1
    },
    "minimum_engine_version": {
      "type": "string",
      "const": "0.4.95"
    },
    "last_updated": {
      "type": "string"
    },
    "record_count": {
      "type": "integer",
      "minimum": 0
    },
    "records": {
      "type": "array",
      "items": {
        "type": "object",
        "required": [
          "asset_id",
          "asset_type",
          "path",
          "metadata",
          "sources",
          "confidence",
          "verified",
          "notes"
        ],
        "properties": {
          "asset_id": {
            "type": "string",
            "pattern": "^asset_[a-z0-9_]+$"
          },
          "asset_type": {
            "type": "string",
            "enum": [
              "icon",
              "flag",
              "portrait",
              "background",
              "font",
              "music",
              "sound",
              "video"
            ]
          },
          "path": {
            "type": "string"
          },
          "metadata": {
            "type": "object",
            "additionalProperties": true
          },
          "sources": {
            "type": "array",
            "items": {
              "type": "string"
            },
            "minItems": 1
          },
          "confidence": {
            "type": "string",
            "enum": [
              "Verified",
              "Probable",
              "Disputed",
              "Unverified"
            ]
          },
          "verified": {
            "type": "boolean"
          },
          "notes": {
            "type": "string"
          }
        },
        "additionalProperties": false
      }
    }
  },
  "additionalProperties": false
}
